{"commitSha":"f1c99eaa998239044b164d32437a9f3c0765b321","contentSha256":"4de590bfba157701412bcef55bc5c6bd36ad244f483323ce87afface655703eb","githubActions":{"acceptedDependencyGraph":{"contentSha256":"140158862e206b5865df5ecde67046f488370000fbd6c8bee41dcdb6cc2b64c7","githubActions":{"automaticWorkflowCount":1,"interpretation":{"maintenancePullRequestIsNotVulnerabilityFinding":true,"mutableMajorRefsRemainReleaseInputs":true,"resolvedCommitDoesNotAuthorizeUpgrade":true},"maintenancePullRequests":[{"classification":"MAINTENANCE_MAJOR_UPDATE_NOT_VULNERABILITY_FINDING","dependency":"actions/setup-node","fromMajor":4,"number":1,"state":"open","toMajor":7},{"classification":"MAINTENANCE_MAJOR_UPDATE_NOT_VULNERABILITY_FINDING","dependency":"actions/checkout","fromMajor":4,"number":2,"state":"open","toMajor":7},{"classification":"MAINTENANCE_MAJOR_UPDATE_NOT_VULNERABILITY_FINDING","dependency":"actions/setup-java","fromMajor":4,"number":4,"state":"open","toMajor":5},{"classification":"MAINTENANCE_MAJOR_UPDATE_NOT_VULNERABILITY_FINDING","dependency":"actions/upload-artifact","fromMajor":4,"number":73,"state":"open","toMajor":7},{"classification":"MAINTENANCE_MAJOR_UPDATE_NOT_VULNERABILITY_FINDING","dependency":"actions/download-artifact","fromMajor":4,"number":94,"state":"open","toMajor":8}],"workflowCount":9,"workflows":[{"actions":[{"declared":"actions/checkout@v4","mutableRef":true,"resolvedCommit":"11d5960a326750d5838078e36cf38b85af677262"},{"declared":"actions/upload-artifact@v4","mutableRef":true,"resolvedCommit":"ea165f8d65b6e75b540449e92b4886f43607fa02"},{"declared":"actions/checkout@v4","mutableRef":true,"resolvedCommit":"11d5960a326750d5838078e36cf38b85af677262"},{"declared":"actions/setup-java@v4","mutableRef":true,"resolvedCommit":"cf277c60eb25467037889841efdb72551f06f6c3"},{"declared":"actions/upload-artifact@v4","mutableRef":true,"resolvedCommit":"ea165f8d65b6e75b540449e92b4886f43607fa02"},{"declared":"actions/checkout@v4","mutableRef":true,"resolvedCommit":"11d5960a326750d5838078e36cf38b85af677262"},{"declared":"actions/setup-java@v4","mutableRef":true,"resolvedCommit":"cf277c60eb25467037889841efdb72551f06f6c3"},{"declared":"actions/upload-artifact@v4","mutableRef":true,"resolvedCommit":"ea165f8d65b6e75b540449e92b4886f43607fa02"},{"declared":"actions/checkout@v4","mutableRef":true,"resolvedCommit":"11d5960a326750d5838078e36cf38b85af677262"},{"declared":"actions/download-artifact@v4","mutableRef":true,"resolvedCommit":"d3f86a106a0bac45b974a628896c90dbdf5c8093"},{"declared":"actions/upload-artifact@v4","mutableRef":true,"resolvedCommit":"ea165f8d65b6e75b540449e92b4886f43607fa02"},{"declared":"actions/upload-artifact/merge@v4","mutableRef":true,"resolvedCommit":"ea165f8d65b6e75b540449e92b4886f43607fa02"},{"declared":"actions/checkout@v4","mutableRef":true,"resolvedCommit":"11d5960a326750d5838078e36cf38b85af677262"},{"declared":"actions/setup-node@v4","mutableRef":true,"resolvedCommit":"49933ea5288caeca8642d1e84afbd3f7d6820020"},{"declared":"actions/upload-artifact@v4","mutableRef":true,"resolvedCommit":"ea165f8d65b6e75b540449e92b4886f43607fa02"},{"declared":"actions/checkout@v4","mutableRef":true,"resolvedCommit":"11d5960a326750d5838078e36cf38b85af677262"},{"declared":"actions/setup-node@v4","mutableRef":true,"resolvedCommit":"49933ea5288caeca8642d1e84afbd3f7d6820020"},{"declared":"actions/upload-artifact@v4","mutableRef":true,"resolvedCommit":"ea165f8d65b6e75b540449e92b4886f43607fa02"}],"automatic":true,"blobSha":"f906302f96b352df54cb3cc903832e743be192d2","path":".github/workflows/approval-platform-validation.yml"},{"actions":[{"declared":"actions/checkout@v4","mutableRef":true,"resolvedCommit":"11d5960a326750d5838078e36cf38b85af677262"},{"declared":"actions/setup-java@v4","mutableRef":true,"resolvedCommit":"cf277c60eb25467037889841efdb72551f06f6c3"},{"declared":"actions/upload-artifact@v4","mutableRef":true,"resolvedCommit":"ea165f8d65b6e75b540449e92b4886f43607fa02"}],"automatic":false,"blobSha":"cc99299ff1d1db1c42f91b75e62b058d0a67a243","path":".github/workflows/backend-ci.yml"},{"actions":[{"declared":"actions/checkout@v4","mutableRef":true,"resolvedCommit":"11d5960a326750d5838078e36cf38b85af677262"},{"declared":"actions/setup-node@v4","mutableRef":true,"resolvedCommit":"49933ea5288caeca8642d1e84afbd3f7d6820020"}],"automatic":false,"blobSha":"ac4c1182bc2a9399e447395a634d007d314d9422","path":".github/workflows/connector-smoke-ci.yml"},{"actions":[{"declared":"actions/checkout@v4","mutableRef":true,"resolvedCommit":"11d5960a326750d5838078e36cf38b85af677262"},{"declared":"actions/setup-node@v4","mutableRef":true,"resolvedCommit":"49933ea5288caeca8642d1e84afbd3f7d6820020"}],"automatic":false,"blobSha":"fe46c261d7425f66c4db9860a949b9bd90d89f54","path":".github/workflows/frontend-ci.yml"},{"actions":[{"declared":"actions/checkout@v4","mutableRef":true,"resolvedCommit":"11d5960a326750d5838078e36cf38b85af677262"},{"declared":"actions/setup-java@v4","mutableRef":true,"resolvedCommit":"cf277c60eb25467037889841efdb72551f06f6c3"},{"declared":"actions/setup-node@v4","mutableRef":true,"resolvedCommit":"49933ea5288caeca8642d1e84afbd3f7d6820020"},{"declared":"actions/upload-artifact@v4","mutableRef":true,"resolvedCommit":"ea165f8d65b6e75b540449e92b4886f43607fa02"}],"automatic":false,"blobSha":"4899db6b69aaad97d90d05d58fcada10e8bdd1a0","path":".github/workflows/generic-spring-host-ci.yml"},{"actions":[{"declared":"actions/checkout@v4","mutableRef":true,"resolvedCommit":"11d5960a326750d5838078e36cf38b85af677262"},{"declared":"actions/setup-node@v4","mutableRef":true,"resolvedCommit":"49933ea5288caeca8642d1e84afbd3f7d6820020"},{"declared":"actions/upload-artifact@v4","mutableRef":true,"resolvedCommit":"ea165f8d65b6e75b540449e92b4886f43607fa02"}],"automatic":false,"blobSha":"cda05d993e0442b07eb609ad22bc21713faac15b","path":".github/workflows/mobile-ci.yml"},{"actions":[{"declared":"actions/checkout@v4","mutableRef":true,"resolvedCommit":"11d5960a326750d5838078e36cf38b85af677262"},{"declared":"actions/setup-java@v4","mutableRef":true,"resolvedCommit":"cf277c60eb25467037889841efdb72551f06f6c3"},{"declared":"actions/setup-node@v4","mutableRef":true,"resolvedCommit":"49933ea5288caeca8642d1e84afbd3f7d6820020"},{"declared":"actions/setup-java@v4","mutableRef":true,"resolvedCommit":"cf277c60eb25467037889841efdb72551f06f6c3"},{"declared":"actions/upload-artifact@v4","mutableRef":true,"resolvedCommit":"ea165f8d65b6e75b540449e92b4886f43607fa02"}],"automatic":false,"blobSha":"1780ac0867ff1033588a674dbc2b9e77764f962a","path":".github/workflows/ruoyi5-host-ci.yml"},{"actions":[{"declared":"actions/checkout@v4","mutableRef":true,"resolvedCommit":"11d5960a326750d5838078e36cf38b85af677262"},{"declared":"actions/setup-java@v4","mutableRef":true,"resolvedCommit":"cf277c60eb25467037889841efdb72551f06f6c3"},{"declared":"actions/setup-node@v4","mutableRef":true,"resolvedCommit":"49933ea5288caeca8642d1e84afbd3f7d6820020"},{"declared":"actions/upload-artifact@v4","mutableRef":true,"resolvedCommit":"ea165f8d65b6e75b540449e92b4886f43607fa02"}],"automatic":false,"blobSha":"7b2dec12bcb281fdaf4aff5b276973c3bd5adf65","path":".github/workflows/ruoyi6-host-ci.yml"},{"actions":[{"declared":"actions/checkout@v4","mutableRef":true,"resolvedCommit":"11d5960a326750d5838078e36cf38b85af677262"},{"declared":"actions/setup-node@v4","mutableRef":true,"resolvedCommit":"49933ea5288caeca8642d1e84afbd3f7d6820020"}],"automatic":false,"blobSha":"4cbf29d043bd78a940cc9f9acf05a6c1c97f6286","path":".github/workflows/web-ci.yml"}]},"limitations":["E2_DOES_NOT_PROVE_VULNERABILITY_APPLICABILITY_OR_REACHABILITY","GITHUB_ACTION_MAJOR_TAGS_REMAIN_MUTABLE_UNTIL_FUTURE_PINNING_REVIEW","PACKAGE_TARBALL_INTEGRITY_NOT_REPOSITORY_PINNED","PRB_16_REMAINS_OPEN","PRB_17_REMAINS_OPEN","ROOT_PNPM_LOCKFILE_ABSENT"],"schemaVersion":"M6_PR_E_E2_ACCEPTED_GITHUB_ACTIONS_GRAPH_V1","sourceHead":"05b830864913b8213267e1eaf4c100d013ba880b"},"automaticWorkflowCount":1,"interpretation":{"maintenancePullRequestIsNotVulnerabilityFinding":true,"mutableMajorRefsRemainReleaseInputs":false,"resolvedCommitDoesNotAuthorizeUpgrade":true,"reviewedImmutableRefsBoundToR2BPlan":true},"maintenancePullRequests":[{"classification":"MAINTENANCE_MAJOR_UPDATE_NOT_VULNERABILITY_FINDING","dependency":"actions/setup-node","fromMajor":4,"number":1,"state":"open","toMajor":7},{"classification":"MAINTENANCE_MAJOR_UPDATE_NOT_VULNERABILITY_FINDING","dependency":"actions/checkout","fromMajor":4,"number":2,"state":"open","toMajor":7},{"classification":"MAINTENANCE_MAJOR_UPDATE_NOT_VULNERABILITY_FINDING","dependency":"actions/setup-java","fromMajor":4,"number":4,"state":"open","toMajor":5},{"classification":"MAINTENANCE_MAJOR_UPDATE_NOT_VULNERABILITY_FINDING","dependency":"actions/upload-artifact","fromMajor":4,"number":73,"state":"open","toMajor":7},{"classification":"MAINTENANCE_MAJOR_UPDATE_NOT_VULNERABILITY_FINDING","dependency":"actions/download-artifact","fromMajor":4,"number":94,"state":"open","toMajor":8}],"r2bPlanCanonicalSha256":"ac926389d07d851f1edfb4a875c45b9064f1744a8e94a45aa8f651864667a6e6","workflowCount":9,"workflowSecurityState":"R2B_REVIEWED_IMMUTABLE_TARGET","workflowToolchainTransition":{"changedWorkflowCount":5,"distributionSha512":"831a8591fe20c8243b1dbe7d71e3244f31d1665b0804b2e825e38cbbe5ce0cafb8338851f90780735568773e0a6cd07bbec107cda0b896b008b861075358b6f6","historicalWorkflowIdentityRetained":true,"java21WorkflowContinuation":{"changedWorkflowCount":1,"historicalWorkflowIdentityRetained":true,"javaMajorVersion":21,"manifestSha256":"90399bc6500b2dcaf36f5897f134769b12ed6ff09677dd1d7edee0f5a47a43e8","priorMavenTransitionManifestSha256":"7179499a14be5d76a06d0ae24b1f80fee5268e3a18cb6dad41db6dded6c9fa6b","schemaVersion":"APPROVAL_HYGIENE_JAVA21_WORKFLOW_CONTINUATION_V1","selectionEnvironment":"JAVA_HOME_21_X64","toolchainSourceBlobs":{"scripts/ci/select-java21.mjs":"216ad9590990f12cde355d9177923f469d17b285"},"workflowBlobs":{".github/workflows/approval-platform-validation.yml":{"fromBlob":"563f504c82630304b1ad2b1